{
  "$schema": "./providers.schema.json",
  "version": "1.0.0",
  "description": "LLM 提供商配置文件 - 复制为 providers.json 并填入你的 API Key",

  "default": "anthropic",

  "providers": {
    "anthropic": {
      "name": "Anthropic (官方)",
      "baseUrl": "https://api.anthropic.com",
      "apiKey": "",
      "model": "claude-sonnet-4-6",
      "models": ["claude-opus-4-6", "claude-sonnet-4-6", "claude-haiku-4-5"],
      "description": "Anthropic Claude 官方 API",
      "enabled": true
    },

    "deepseek": {
      "name": "DeepSeek",
      "baseUrl": "https://api.deepseek.com/anthropic",
      "apiKey": "",
      "model": "deepseek-chat",
      "models": ["deepseek-chat", "deepseek-reasoner"],
      "description": "DeepSeek 大模型，性价比高",
      "enabled": true
    },

    "glm": {
      "name": "GLM (智谱)",
      "baseUrl": "https://open.bigmodel.cn/api/anthropic",
      "apiKey": "",
      "model": "glm-5",
      "models": ["glm-5", "glm-4.7", "glm-4-plus", "glm-4-flash"],
      "description": "智谱清言大模型，支持长文本、多模态",
      "enabled": true
    },

    "qwen": {
      "name": "Qwen (通义千问)",
      "baseUrl": "https://dashscope.aliyuncs.com/apps/anthropic",
      "apiKey": "",
      "model": "qwen3-max",
      "models": ["qwen3-max", "qwen3-72b", "qwen3-32b", "qwen-plus", "qwen-turbo"],
      "description": "阿里云通义千问大模型",
      "enabled": true
    },

    "kimi": {
      "name": "Kimi (月之暗面)",
      "baseUrl": "https://api.moonshot.cn/anthropic",
      "apiKey": "",
      "model": "moonshot-v1-128k",
      "models": ["moonshot-v1-128k", "moonshot-v1-32k", "moonshot-v1-8k"],
      "description": "Kimi 大模型，超长上下文支持",
      "enabled": true
    },

    "openai": {
      "name": "OpenAI",
      "baseUrl": "https://api.openai.com/v1",
      "apiKey": "",
      "model": "gpt-4o",
      "models": ["gpt-4o", "gpt-4o-mini", "gpt-4-turbo", "gpt-3.5-turbo"],
      "description": "OpenAI GPT 系列模型",
      "note": "需要使用兼容层转换为 Anthropic 格式",
      "enabled": false
    },

    "openrouter": {
      "name": "OpenRouter",
      "baseUrl": "https://openrouter.ai/api/v1",
      "apiKey": "",
      "model": "anthropic/claude-sonnet-4",
      "models": [
        "anthropic/claude-opus-4",
        "anthropic/claude-sonnet-4",
        "openai/gpt-4o",
        "google/gemini-pro-1.5",
        "deepseek/deepseek-chat"
      ],
      "description": "OpenRouter 聚合网关，支持 100+ 模型",
      "enabled": true
    },

    "litellm": {
      "name": "LiteLLM (本地)",
      "baseUrl": "http://localhost:4000",
      "apiKey": "sk-litellm",
      "model": "gpt-4o",
      "models": ["*"],
      "description": "LiteLLM 统一网关，需要自行部署",
      "enabled": false
    }
  },

  "mcp_servers": {
    "filesystem": {
      "command": "npx",
      "args": ["-y", "@anthropic-ai/mcp-server-filesystem", "/path/to/allowed/dir"],
      "enabled": false
    },
    "memory": {
      "command": "npx",
      "args": ["-y", "@anthropic-ai/mcp-server-memory"],
      "enabled": true
    }
  },

  "agent_defaults": {
    "explore": {
      "model": "claude-haiku-4-5",
      "maxTurns": 5,
      "thoroughness": "medium"
    },
    "plan": {
      "maxTurns": 10
    },
    "general": {
      "maxTurns": 20
    }
  }
}
